{
  "job_ids": ["local-4c77e0b912"],
  "submitted": "2026-07-05T18:04:12Z",
  "completed": "2026-07-05T18:04:41Z",
  "shots": 8192,
  "counts_raw": {
    "00000000": 3921,
    "11111111": 3874,
    "00000001": 41,
    "10000000": 39,
    "01111111": 44,
    "11111110": 38,
    "00000011": 22,
    "11111100": 21,
    "00000111": 52,
    "11100000": 49,
    "01111110": 45,
    "10000001": 46
  },
  "counts_mitigated": {
    "00000000": 4076,
    "11111111": 4033,
    "00000001": 20,
    "10000000": 18,
    "01111111": 23,
    "11111110": 22
  }
}
